{
  "sheet_behaviour": "1.0",
  "units": {
    "caliper": "mm",
    "areal_density": "kg/m^2",
    "membrane": "N/m",
    "bending": "N*m",
    "angle": "deg",
    "laminate": "A N/m, B N, D N*m"
  },
  "axis_1": "machine",
  "caliper_mm": 0.47,
  "areal_density_kg_m2": 0.3,
  "source": {
    "platform": "pliego",
    "material_slug": "folding-boxboard-300",
    "rule": "pliego-stock/1",
    "card_basis": "pliego.stock.derive v1"
  },
  "membrane": {
    "E1t": 1300000,
    "E2t": 612001,
    "G12t": 345190,
    "nu12": 0.427035
  },
  "bending": {
    "D11": 0.036688,
    "D22": 0.0178386,
    "D12": 0.00749364,
    "D66": 0.00904807
  },
  "crease": {
    "crease_length_scale_t": 75,
    "crease_yield_deg": 35,
    "crease_set_rate": 0.5,
    "score_factor": 0.35
  },
  "regime": {
    "inextensible": true,
    "stretchy": false,
    "compressible": false,
    "layered": true,
    "self_folding": false
  },
  "laminate": {
    "layers": [
      {
        "material": "pliego/folding-boxboard-300 construction.layers[2] ply",
        "angle_deg": 0,
        "thickness_mm": 0.04,
        "own_bending": "plate"
      },
      {
        "material": "pliego/folding-boxboard-300 construction.layers[1] ply",
        "angle_deg": 0,
        "thickness_mm": 0.38,
        "own_bending": "plate"
      },
      {
        "material": "pliego/folding-boxboard-300 construction.layers[0] ply",
        "angle_deg": 0,
        "thickness_mm": 0.05,
        "own_bending": "plate"
      }
    ],
    "A": [
      [
        1422080,
        285792,
        0
      ],
      [
        285792,
        669474,
        0
      ],
      [
        0,
        0,
        345073
      ]
    ],
    "B": [
      [
        8.31372,
        1.76665,
        0
      ],
      [
        1.76665,
        4.36471,
        0
      ],
      [
        0,
        0,
        2.13311
      ]
    ],
    "D": [
      [
        0.0367366,
        0.0075046,
        0
      ],
      [
        0.0075046,
        0.0178671,
        0
      ],
      [
        0,
        0,
        0.00906126
      ]
    ],
    "coupled": true,
    "coupling_ratio": 0.0363733
  },
  "contact": {
    "friction_static": 0.4
  },
  "provenance": {
    "caliper_mm": {
      "status": "estimated",
      "basis": "derived.thickness; physical.caliper_um estimated: implied by the construction block (pliego.board v1)"
    },
    "areal_density_kg_m2": {
      "status": "estimated",
      "basis": "derived.areal_density (g/mm²) × 1000; physical.gsm estimated: implied by the construction block (pliego.board v1)"
    },
    "E1t": {
      "status": "estimated",
      "basis": "derived.E_md × t; physical.E_md_gpa estimated: implied by the construction block (pliego.board v1); physical.caliper_um estimated: implied by the construction block (pliego.board v1)"
    },
    "E2t": {
      "status": "estimated",
      "basis": "derived.E_cd × t; physical.E_cd_gpa estimated: implied by the construction block (pliego.board v1); physical.caliper_um estimated: implied by the construction block (pliego.board v1)"
    },
    "G12t": {
      "status": "estimated",
      "basis": "derived.G12 × t, G12 = 0.387·√(E_md·E_cd) (Baum, Brennan & Habeger 1981, via pliego.stock.derive v1)"
    },
    "nu12": {
      "status": "estimated",
      "basis": "ν12 = ν·√(E_md/E_cd): the card's ν is the geometric mean √(ν12·ν21), split by reciprocity ν12/E1 = ν21/E2; physical.nu estimated: √(ν12·ν21) = 0.293 for machine-made paper (Baum et al. 1981); the board value is unmeasured [E]"
    },
    "D11": {
      "status": "estimated",
      "basis": "derived.D_md × 1e-9 (N·m): sandwich bending about the MD neutral axis, Σ E·(t³/12 + t·(z − z̄)²)/(1 − ν²) over the card's construction block (pliego.board v1, Allen 1969) via pliego.stock.derive v1, transverse shear of the core not included; construction.layers ['estimated']; physical.nu estimated: √(ν12·ν21) = 0.293 for machine-made paper (Baum et al. 1981); the board value is unmeasured [E]"
    },
    "D22": {
      "status": "estimated",
      "basis": "derived.D_cd × 1e-9 (N·m): sandwich bending about the CD neutral axis, Σ E·(t³/12 + t·(z − z̄)²)/(1 − ν²) over the card's construction block (pliego.board v1, Allen 1969) via pliego.stock.derive v1, transverse shear of the core not included; construction.layers ['estimated']; physical.nu estimated: √(ν12·ν21) = 0.293 for machine-made paper (Baum et al. 1981); the board value is unmeasured [E]"
    },
    "D12": {
      "status": "estimated",
      "basis": "D*12, the free-stack D* = D − B·A⁻¹·B of the laminate block, which rebuilds the construction layer by layer (hyperobjects_sheet.board): liners and plies with ν12 = ν·√(E_md/E_cd); the medium carries no Poisson term"
    },
    "D66": {
      "status": "estimated",
      "basis": "D*66, the free-stack D* = D − B·A⁻¹·B of the laminate block, which rebuilds the construction layer by layer (hyperobjects_sheet.board): liners and plies with ν12 = ν·√(E_md/E_cd) and the Baum estimate G12 = 0.387·√(E_md·E_cd) per layer; the medium's in-plane shear is neglected, as pliego.board v1 neglects its MD load, so this is a lower bound"
    },
    "crease_length_scale_t": {
      "status": "estimated",
      "basis": "physical.crease_length_scale_t estimated: scored board: L* = 50–100 t (memo §a3, Beex & Peerlings 2009 qualitative); mid value [E]"
    },
    "crease_yield_deg": {
      "status": "estimated",
      "basis": "physical.crease_yield_deg estimated: rest opening 27–43° after creasing (Lechenault 2014, Mylar); board unmeasured [E]"
    },
    "crease_set_rate": {
      "status": "estimated",
      "basis": "pliego.stock.derive v1 default (card has no physical.crease_set_rate)"
    },
    "score_factor": {
      "status": "estimated",
      "basis": "pliego.stock.derive v1 default (card has no physical.score_factor)"
    },
    "friction_static": {
      "status": "estimated",
      "basis": "physical.friction estimated: kraft on kraft 0.3–0.6 (rsE §a3) [E]"
    }
  },
  "notes": [
    "friction: the card states one paper-on-paper coefficient; it is written as friction_static, and friction_kinetic and damping are left out rather than invented",
    "board: the laminate block rebuilds the card's construction (pliego.board v1) as a classical laminate about the mid-plane; its free-stack D* gives D11 +0.00 % and D22 +0.00 % against the card's D_md and D_cd, which are kept (D* also carries the Poisson cross terms the card's per-direction sums omit)",
    "board: B is non-zero (|B|/√(|A|·|D|) = 0.0364): the stack is asymmetric, so stretching and bending are coupled and it curls under in-plane load or a layer's pre-strain"
  ]
}
