{
  "sheet_behaviour": "1.0",
  "units": {
    "caliper": "mm",
    "areal_density": "kg/m^2",
    "membrane": "N/m",
    "bending": "N*m",
    "angle": "deg"
  },
  "axis_1": "machine",
  "caliper_mm": 0.08,
  "areal_density_kg_m2": 0.03,
  "source": {
    "platform": "pliego",
    "material_slug": "washi-kozo-30",
    "rule": "pliego-stock/1",
    "card_basis": "pliego.stock.derive v1"
  },
  "membrane": {
    "E1t": 120000,
    "E2t": 80000,
    "G12t": 37918.1,
    "nu12": 0.35885
  },
  "bending": {
    "D11": 7.00103e-05,
    "D22": 4.66735e-05,
    "D12": 1.67488e-05,
    "D66": 2.0223e-05
  },
  "crease": {
    "crease_length_scale_t": 200,
    "crease_yield_deg": 35,
    "crease_set_rate": 0.5,
    "score_factor": 0.35
  },
  "regime": {
    "inextensible": true,
    "stretchy": false,
    "compressible": false,
    "layered": false,
    "self_folding": false
  },
  "contact": {
    "friction_static": 0.4
  },
  "provenance": {
    "caliper_mm": {
      "status": "estimated",
      "basis": "derived.thickness; physical.caliper_um estimated: rsE §b"
    },
    "areal_density_kg_m2": {
      "status": "estimated",
      "basis": "derived.areal_density (g/mm²) × 1000; physical.gsm estimated: thin handmade kozo washi, rsE §b"
    },
    "E1t": {
      "status": "estimated",
      "basis": "derived.E_md × t; physical.E_md_gpa estimated: handmade, near-isotropic; rsE §b [E]; physical.caliper_um estimated: rsE §b"
    },
    "E2t": {
      "status": "estimated",
      "basis": "derived.E_cd × t; physical.E_cd_gpa estimated: handmade sheet, near-isotropic: MD/CD ≈ 1.5 (rsE §b) [E]; physical.caliper_um estimated: rsE §b"
    },
    "G12t": {
      "status": "estimated",
      "basis": "derived.G12 × t, G12 = 0.387·√(E_md·E_cd) (Baum, Brennan & Habeger 1981, via pliego.stock.derive v1)"
    },
    "nu12": {
      "status": "estimated",
      "basis": "ν12 = ν·√(E_md/E_cd): the card's ν is the geometric mean √(ν12·ν21), split by reciprocity ν12/E1 = ν21/E2; physical.nu estimated: √(ν12·ν21) = 0.293 for machine-made paper (Baum et al. 1981)"
    },
    "D11": {
      "status": "estimated",
      "basis": "derived.D_md × 1e-9 (N·m), plate E·t³/(12(1−ν²)) in pliego.stock.derive v1; physical.E_md_gpa estimated: handmade, near-isotropic; rsE §b [E]; physical.nu estimated: √(ν12·ν21) = 0.293 for machine-made paper (Baum et al. 1981); physical.caliper_um estimated: rsE §b"
    },
    "D22": {
      "status": "estimated",
      "basis": "derived.D_cd × 1e-9 (N·m), plate E·t³/(12(1−ν²)) in pliego.stock.derive v1; physical.E_cd_gpa estimated: handmade sheet, near-isotropic: MD/CD ≈ 1.5 (rsE §b) [E]; physical.nu estimated: √(ν12·ν21) = 0.293 for machine-made paper (Baum et al. 1981); physical.caliper_um estimated: rsE §b"
    },
    "D12": {
      "status": "estimated",
      "basis": "ν21·D11, orthotropic plate (ν21 = ν·√(E_cd/E_md))"
    },
    "D66": {
      "status": "estimated",
      "basis": "G12·t³/12 with the estimated G12 above"
    },
    "crease_length_scale_t": {
      "status": "estimated",
      "basis": "physical.crease_length_scale_t estimated: L* ≈ 200·t measured on Mylar (Lechenault 2014); paper unmeasured"
    },
    "crease_yield_deg": {
      "status": "estimated",
      "basis": "physical.crease_yield_deg estimated: rest opening 27–43° after creasing (Lechenault 2014)"
    },
    "crease_set_rate": {
      "status": "estimated",
      "basis": "pliego.stock.derive v1 default (card has no physical.crease_set_rate)"
    },
    "score_factor": {
      "status": "estimated",
      "basis": "pliego.stock.derive v1 default (card has no physical.score_factor)"
    },
    "friction_static": {
      "status": "estimated",
      "basis": "physical.friction estimated: paper on paper 0.3–0.6 (rsE §a3)"
    }
  },
  "notes": [
    "friction: the card states one paper-on-paper coefficient; it is written as friction_static, and friction_kinetic and damping are left out rather than invented"
  ]
}
